{
  "$schema": "https://json-schema.org/draft/2020-12/schema",
  "$id": "https://github.com/durable-workflow/.github/blob/main/repository-hygiene/inventory-schema.json",
  "title": "Durable Workflow public repository hygiene inventory",
  "type": "object",
  "additionalProperties": false,
  "required": [
    "$schema",
    "schema",
    "organization",
    "completed_on",
    "cleanup_release_train",
    "reviewed_surfaces",
    "repositories"
  ],
  "properties": {
    "$schema": {
      "const": "./inventory-schema.json"
    },
    "schema": {
      "const": "durable-workflow.public-repository-hygiene/v1"
    },
    "organization": {
      "const": "durable-workflow"
    },
    "completed_on": {
      "type": "string",
      "format": "date"
    },
    "cleanup_release_train": {
      "type": "string",
      "pattern": "^2\\.0\\.0-beta\\.[1-9][0-9]*$"
    },
    "reviewed_surfaces": {
      "type": "array",
      "minItems": 7,
      "uniqueItems": true,
      "items": {
        "enum": [
          "phase-and-progress-documents",
          "bootstrap-and-prerelease-plans",
          "experiments",
          "workflows",
          "assets",
          "dependencies",
          "release-and-recovery-artifacts",
          "documentation-validation"
        ]
      }
    },
    "repositories": {
      "type": "array",
      "minItems": 1,
      "items": {
        "$ref": "#/$defs/repository"
      }
    }
  },
  "$defs": {
    "repository": {
      "type": "object",
      "additionalProperties": false,
      "required": [
        "repository",
        "branch",
        "disposition",
        "removals",
        "retained_surfaces"
      ],
      "properties": {
        "repository": {
          "type": "string",
          "minLength": 1
        },
        "branch": {
          "enum": [
            "main",
            "v2"
          ]
        },
        "disposition": {
          "enum": [
            "maintained",
            "cleaned",
            "retired-bootstrap"
          ]
        },
        "removals": {
          "type": "array",
          "uniqueItems": true,
          "items": {
            "type": "string",
            "minLength": 1
          }
        },
        "retained_surfaces": {
          "type": "array",
          "minItems": 1,
          "uniqueItems": true,
          "items": {
            "enum": [
              "product-source",
              "public-api",
              "operator-guidance",
              "user-guidance",
              "release-history",
              "release-delivery",
              "release-recovery",
              "qualification",
              "conformance",
              "visual-evidence",
              "examples",
              "retirement-guidance"
            ]
          }
        }
      }
    }
  }
}
