{
  "$schema": "./inventory-schema.json",
  "schema": "durable-workflow.public-repository-hygiene/v1",
  "organization": "durable-workflow",
  "completed_on": "2026-07-26",
  "cleanup_release_train": "2.0.0-beta.17",
  "reviewed_surfaces": [
    "phase-and-progress-documents",
    "bootstrap-and-prerelease-plans",
    "experiments",
    "workflows",
    "assets",
    "dependencies",
    "release-and-recovery-artifacts",
    "documentation-validation"
  ],
  "repositories": [
    {
      "repository": ".github",
      "branch": "main",
      "disposition": "maintained",
      "removals": [],
      "retained_surfaces": [
        "release-delivery",
        "release-recovery",
        "qualification",
        "conformance",
        "visual-evidence",
        "operator-guidance"
      ]
    },
    {
      "repository": "workflow",
      "branch": "v2",
      "disposition": "cleaned",
      "removals": [
        "copy-coupled Markdown documentation tests"
      ],
      "retained_surfaces": [
        "product-source",
        "public-api",
        "user-guidance",
        "operator-guidance",
        "release-history",
        "release-delivery",
        "release-recovery"
      ]
    },
    {
      "repository": "waterline",
      "branch": "v2",
      "disposition": "cleaned",
      "removals": [
        "ACCESSIBILITY_AUDIT.md",
        "FRONTEND_MODERNIZATION_EVAL.md",
        "PHASE_0_PROGRESS.md"
      ],
      "retained_surfaces": [
        "product-source",
        "public-api",
        "user-guidance",
        "operator-guidance",
        "release-history",
        "release-delivery",
        "release-recovery"
      ]
    },
    {
      "repository": "server",
      "branch": "main",
      "disposition": "cleaned",
      "removals": [
        "copy-coupled Markdown documentation assertions"
      ],
      "retained_surfaces": [
        "product-source",
        "public-api",
        "user-guidance",
        "operator-guidance",
        "release-delivery",
        "release-recovery",
        "conformance"
      ]
    },
    {
      "repository": "cli",
      "branch": "main",
      "disposition": "cleaned",
      "removals": [
        "references to retired Markdown-copy tests"
      ],
      "retained_surfaces": [
        "product-source",
        "public-api",
        "user-guidance",
        "release-delivery",
        "release-recovery",
        "conformance"
      ]
    },
    {
      "repository": "ai",
      "branch": "main",
      "disposition": "retired-bootstrap",
      "removals": [
        ".gitignore",
        "composer.json"
      ],
      "retained_surfaces": [
        "retirement-guidance",
        "release-history"
      ]
    },
    {
      "repository": "sample-app",
      "branch": "main",
      "disposition": "cleaned",
      "removals": [
        "copy-coupled README assertions"
      ],
      "retained_surfaces": [
        "product-source",
        "user-guidance",
        "examples",
        "release-delivery",
        "conformance"
      ]
    },
    {
      "repository": "sdk-php",
      "branch": "main",
      "disposition": "maintained",
      "removals": [],
      "retained_surfaces": [
        "product-source",
        "public-api",
        "user-guidance",
        "release-history",
        "release-delivery",
        "release-recovery"
      ]
    },
    {
      "repository": "sdk-python",
      "branch": "main",
      "disposition": "maintained",
      "removals": [],
      "retained_surfaces": [
        "product-source",
        "public-api",
        "user-guidance",
        "release-history",
        "release-delivery",
        "release-recovery",
        "conformance"
      ]
    },
    {
      "repository": "sdk-rust",
      "branch": "main",
      "disposition": "maintained",
      "removals": [],
      "retained_surfaces": [
        "product-source",
        "public-api",
        "user-guidance",
        "release-delivery",
        "release-recovery"
      ]
    },
    {
      "repository": "durable-workflow.github.io",
      "branch": "main",
      "disposition": "cleaned",
      "removals": [
        "references to retired Markdown-copy tests"
      ],
      "retained_surfaces": [
        "user-guidance",
        "operator-guidance",
        "release-history",
        "release-delivery",
        "qualification",
        "conformance"
      ]
    }
  ]
}
